{
  "nodes_count": 384,
  "edges_count": 36,
  "edges": [
    {
      "source": "CAM_S01_C001_trk_002",
      "target": "CAM_S01_C001_trk_019",
      "score": 0.718,
      "probability": 0.718,
      "evidence": {
        "appearance_similarity": 0.8703,
        "appearance_status": "available",
        "identity_evidence_available": true,
        "vehicle_type_match": true,
        "vehicle_type_status": "compatible",
        "temporal_feasibility": 1.0,
        "temporal_status": "plausible_time_gap",
        "temporal_evidence": {
          "comparable": true,
          "status": "available",
          "reason": "same_camera_video_relative_valid",
          "delta_seconds": 10.5,
          "timestamp_semantics": "video_relative",
          "time_reference_id": "CAM_S01_C001",
          "used_in_route_scoring": true
        },
        "spatial_feasibility": 0.5,
        "plate_similarity": null,
        "time_difference_seconds": 10.5,
        "geographic_distance_meters": 0.0,
        "required_speed_kmh": null
      },
      "evidence_ledger": {
        "plate": {
          "status": "missing",
          "detailed_status": "missing",
          "value": null,
          "score": null,
          "confidence": null,
          "contribution": null,
          "source": "missing"
        },
        "appearance": {
          "status": "available",
          "detailed_status": "available_supportive",
          "value": 0.8703,
          "score": 0.8703,
          "contribution": 0.8703,
          "source": "actual_observation"
        },
        "vehicle_type": {
          "status": "compatible",
          "detailed_status": "available_supportive",
          "value": 1.0,
          "score": 1.0,
          "contribution": 0.3,
          "source": "actual_observation"
        },
        "temporal": {
          "status": "unverified",
          "detailed_status": "unverified",
          "value": 1.0,
          "score": 1.0,
          "contribution": 0.35,
          "delta_t_seconds": 10.5,
          "source": "actual_observation"
        },
        "spatial": {
          "status": "feasible",
          "detailed_status": "available_supportive",
          "value": 0.5,
          "score": 0.5,
          "contribution": 0.175,
          "distance_meters": 0.0,
          "source": "unavailable"
        }
      },
      "explanation": "Estimated match probability is 0.72: Appearance similarity is 0.87 (high), vehicle types are compatible (car vs car)."
    },
    {
      "source": "CAM_S01_C001_trk_002",
      "target": "CAM_S01_C001_trk_027",
      "score": 0.7238,
      "probability": 0.7238,
      "evidence": {
        "appearance_similarity": 0.8773,
        "appearance_status": "available",
        "identity_evidence_available": true,
        "vehicle_type_match": true,
        "vehicle_type_status": "compatible",
        "temporal_feasibility": 1.0,
        "temporal_status": "plausible_time_gap",
        "temporal_evidence": {
          "comparable": true,
          "status": "available",
          "reason": "same_camera_video_relative_valid",
          "delta_seconds": 12.6,
          "timestamp_semantics": "video_relative",
          "time_reference_id": "CAM_S01_C001",
          "used_in_route_scoring": true
        },
        "spatial_feasibility": 0.5,
        "plate_similarity": null,
        "time_difference_seconds": 12.6,
        "geographic_distance_meters": 0.0,
        "required_speed_kmh": null
      },
      "evidence_ledger": {
        "plate": {
          "status": "missing",
          "detailed_status": "missing",
          "value": null,
          "score": null,
          "confidence": null,
          "contribution": null,
          "source": "missing"
        },
        "appearance": {
          "status": "available",
          "detailed_status": "available_supportive",
          "value": 0.8773,
          "score": 0.8773,
          "contribution": 0.8773,
          "source": "actual_observation"
        },
        "vehicle_type": {
          "status": "compatible",
          "detailed_status": "available_supportive",
          "value": 1.0,
          "score": 1.0,
          "contribution": 0.3,
          "source": "actual_observation"
        },
        "temporal": {
          "status": "unverified",
          "detailed_status": "unverified",
          "value": 1.0,
          "score": 1.0,
          "contribution": 0.35,
          "delta_t_seconds": 12.6,
          "source": "actual_observation"
        },
        "spatial": {
          "status": "feasible",
          "detailed_status": "available_supportive",
          "value": 0.5,
          "score": 0.5,
          "contribution": 0.175,
          "distance_meters": 0.0,
          "source": "unavailable"
        }
      },
      "explanation": "Estimated match probability is 0.72: Appearance similarity is 0.88 (high), vehicle types are compatible (car vs car)."
    },
    {
      "source": "CAM_S01_C002_trk_265",
      "target": "CAM_S01_C002_trk_372",
      "score": 0.7259,
      "probability": 0.7259,
      "evidence": {
        "appearance_similarity": 0.8799,
        "appearance_status": "available",
        "identity_evidence_available": true,
        "vehicle_type_match": true,
        "vehicle_type_status": "compatible",
        "temporal_feasibility": 1.0,
        "temporal_status": "plausible_time_gap",
        "temporal_evidence": {
          "comparable": true,
          "status": "available",
          "reason": "same_camera_video_relative_valid",
          "delta_seconds": 47.1,
          "timestamp_semantics": "video_relative",
          "time_reference_id": "CAM_S01_C002",
          "used_in_route_scoring": true
        },
        "spatial_feasibility": 0.5,
        "plate_similarity": null,
        "time_difference_seconds": 47.1,
        "geographic_distance_meters": 0.0,
        "required_speed_kmh": null
      },
      "evidence_ledger": {
        "plate": {
          "status": "missing",
          "detailed_status": "missing",
          "value": null,
          "score": null,
          "confidence": null,
          "contribution": null,
          "source": "missing"
        },
        "appearance": {
          "status": "available",
          "detailed_status": "available_supportive",
          "value": 0.8799,
          "score": 0.8799,
          "contribution": 0.8799,
          "source": "actual_observation"
        },
        "vehicle_type": {
          "status": "compatible",
          "detailed_status": "available_supportive",
          "value": 1.0,
          "score": 1.0,
          "contribution": 0.3,
          "source": "actual_observation"
        },
        "temporal": {
          "status": "unverified",
          "detailed_status": "unverified",
          "value": 1.0,
          "score": 1.0,
          "contribution": 0.35,
          "delta_t_seconds": 47.1,
          "source": "actual_observation"
        },
        "spatial": {
          "status": "feasible",
          "detailed_status": "available_supportive",
          "value": 0.5,
          "score": 0.5,
          "contribution": 0.175,
          "distance_meters": 0.0,
          "source": "unavailable"
        }
      },
      "explanation": "Estimated match probability is 0.73: Appearance similarity is 0.88 (high), vehicle types are compatible (car vs car)."
    },
    {
      "source": "CAM_S01_C002_trk_275",
      "target": "CAM_S01_C002_trk_320",
      "score": 0.7436,
      "probability": 0.7436,
      "evidence": {
        "appearance_similarity": 0.9013,
        "appearance_status": "available",
        "identity_evidence_available": true,
        "vehicle_type_match": true,
        "vehicle_type_status": "compatible",
        "temporal_feasibility": 1.0,
        "temporal_status": "plausible_time_gap",
        "temporal_evidence": {
          "comparable": true,
          "status": "available",
          "reason": "same_camera_video_relative_valid",
          "delta_seconds": 17.6,
          "timestamp_semantics": "video_relative",
          "time_reference_id": "CAM_S01_C002",
          "used_in_route_scoring": true
        },
        "spatial_feasibility": 0.5,
        "plate_similarity": null,
        "time_difference_seconds": 17.6,
        "geographic_distance_meters": 0.0,
        "required_speed_kmh": null
      },
      "evidence_ledger": {
        "plate": {
          "status": "missing",
          "detailed_status": "missing",
          "value": null,
          "score": null,
          "confidence": null,
          "contribution": null,
          "source": "missing"
        },
        "appearance": {
          "status": "available",
          "detailed_status": "available_supportive",
          "value": 0.9013,
          "score": 0.9013,
          "contribution": 0.9013,
          "source": "actual_observation"
        },
        "vehicle_type": {
          "status": "compatible",
          "detailed_status": "available_supportive",
          "value": 1.0,
          "score": 1.0,
          "contribution": 0.3,
          "source": "actual_observation"
        },
        "temporal": {
          "status": "unverified",
          "detailed_status": "unverified",
          "value": 1.0,
          "score": 1.0,
          "contribution": 0.35,
          "delta_t_seconds": 17.6,
          "source": "actual_observation"
        },
        "spatial": {
          "status": "feasible",
          "detailed_status": "available_supportive",
          "value": 0.5,
          "score": 0.5,
          "contribution": 0.175,
          "distance_meters": 0.0,
          "source": "unavailable"
        }
      },
      "explanation": "Estimated match probability is 0.74: Appearance similarity is 0.90 (high), vehicle types are compatible (car vs car)."
    },
    {
      "source": "CAM_S01_C002_trk_303",
      "target": "CAM_S01_C002_trk_327",
      "score": 0.7397,
      "probability": 0.7397,
      "evidence": {
        "appearance_similarity": 0.8966,